"title","url","course_num","subjects","grade_levels","length","type","uccsu","prereq","enroll_criteria","fulfillment","description"
"Journalism II","https://curriculum.siprep.org/courses/journalism-ii/","9411","College Preparatory Electives","10, 11, 12","Year","Elective","G","Journalism","Strong interest in journalism, desktop publishing, editing, and writing. Admission is by application, and enrollment is via roster submitted by instructor. Students should not list this course on their Schedule Request Forms.","","Students enrolled in Journalism-II will serve as a second-year Managing Editor for Inside SI . Journalism-II is an 8th period course in which students will learn the skills necessary to serve as Managing Editors for the school newspaper of St. Ignatius, Inside SI . The primary objective of this class is the publishing of six issues of Inside SI. As such, students will be involved in editorial decisions, including determining content, supervising reporters in their section (Affinity, Arts, Feature, Humor, Op-Ed, Outside SI News, SI News, Sports, Spotlight), writing articles, editing, and suggesting lay out for pages in each issue. Students enrolled in this course will practice effective collaboration skills (both on-line and in-person) and will work to ensure Inside SI reflects the diverse and unique voices of all members of the SI community. This course will NOT be included in the SI GPA calculation. Enrollment in this class is subject to Moderator Approval. Individuals who apply for and are accepted as Managing Editors the previous Spring semester will be enrolled by the moderators during the Fall semester of the school year. Students will meet regularly each week. * This course is offered outside of the 9:00 am – 2:45 pm school day, 8 th period ONLY: This class meets weekly to discuss journalism topics and conduct planning for issues. During the two weeks prior to each issue’s production, students will meet every day after school for approximately 3 hours."
"Language Teaching Assistant","https://curriculum.siprep.org/courses/language-teaching-assistant/","","","10, 11, 12","Semester","Elective","","None","Permission of instructor or Department. Enrollment is via roster submitted by instructor. Students should not list this course on their Schedule Request Forms.","","Language Teaching Assistants provide support for the Language faculty for 1 hour/week. Teaching Assistants fulfill the following duties: checking homework grading objective sections of tests doing Internet or other research decorating bulletin boards peer tutoring Normally, the student will help before school or after school. There will be times when some of the correcting may be taken home for delivery on the following day. Interested students may apply by requesting and completing a Teaching Assistant Contract from their teacher."
"Latin 1","https://curriculum.siprep.org/courses/latin-1/","4310","Latin","9, 10, 11","Year","Elective","E","None","None","Meets one year of language graduation requirement","The Cambridge Latin Course, Units 1 and 2 , open the door to the Latin language and literature for the beginning student through adapted readings about a Roman family living in Pompeii. Students will engage in the following activities: reading Latin aloud and silently; asking and answering Latin questions about the readings; translating Latin sentences into English and vice-versa; memorizing and using vocabulary; developing listening and speaking skills; studying the history and origin of English words derived from Latin; and learning about the customs, history, and mythology of the ancient Romans, especially as they have affected our own culture today. The aims of the course are: to teach students to read Latin accurately and confidently; and to familiarize students with life in the early Roman Empire."
"Latin 2","https://curriculum.siprep.org/courses/latin-2/","4320","Latin","10, 11, 12","Year","Elective","E","Latin 1 or placement by examination","Satisfactory completion of Latin 1 or placement by written examination","Meets one year of language graduation requirement","Latin 2 continues the progress of first-year Latin. Students will read and write more sophisticated Latin, incorporating passive voice, various types of clauses, participles, infinitives and the subjunctive mood (mode), as they begin to transition to “real Latin,” authentic primary sources from the Roman era."
"Latin 2 Honors","https://curriculum.siprep.org/courses/latin-2h/","4323","Latin","10, 11, 12","Year","AP/Honors, Elective","E","Latin 1 or placement by examination","See criteria for Honors Enrollment","Meets one year of language graduation requirement","In Latin 2H, the more advanced students will more quickly acquire new knowledge of Latin grammar and sentence structures to enable them to read more sophisticated works of prose and poetry. Students continue to learn about various aspects of Roman culture and history using the Cambridge Latin Course Unit 3. *Class receives honors weighting in SI weighted GPA"
"Latin 3 Honors","https://curriculum.siprep.org/courses/latin-3h/","4333","Latin","10, 11, 12","Year","AP/Honors, Elective","E","Latin 2 or 2H or placement by examination","Latin 2 and teacher recommendation. See criteria for Honors Enrollment.","Meets one year of language graduation requirement","Cambridge Latin Course Unit 4 . Latin 3H is an advanced language course designed for the superior Latin students who wish to continue to refine their Latin skills and reading ability. New grammar includes all uses of the subjunctive mood, gerund and gerundive; the student’s overriding task is to read and comprehend the variety of clauses and constructions which typically form the Latin periodic sentence. A study of rhetoric accompanies readings from speeches of Cicero. In addition to the prose readings mentioned in the description of Latin 3, the 3H student will study a selected Latin author, reading excerpts from his original works. Latin 3H is strongly recommended for students intending to enroll in Latin 4AP in the following year. *Class receives honors weighting in SI weighted GPA and UC/CSU GPA calculations"
"Latin 3: Poetry (Love and Hate)","https://curriculum.siprep.org/courses/latin-3-poetry-love-and-hate-2/","4330","Latin","10, 11, 12","Year","Elective","E","Latin 2 or 2H or placement by examination","Minimum semester grade of C+ in Latin 2 or teacher recommendation","Elective which meets one year of language graduation requirement","Latin 3 Poetry is an intermediate level language course designed for those students who have acquired satisfactory competency during their first two years of language study. The course builds upon the skills and material covered in Latin 1 and 2. It reviews all major grammatical structures and introduces a broader scope of grammatical knowledge. Latin 3 students will acquire greater confidence in their ability to read and translate Latin through the love poems of Catullus and the mythological stories of Ovid. NOTE : LATIN 3 POETRY is offered in the Fall of even years (2024, 2026, etc.)"
"Latin 3: Prose (Heroes and Villains)","https://curriculum.siprep.org/courses/latin-3-prose-heroes-and-villains/","4330","Latin","10, 11, 12","Year","Elective","E","Latin 2 or 2H or placement by examination","Minimum semester grade of C+ in Latin 2 or teacher recommendation","Elective which meets one year of language graduation requirement","Latin 3 Prose is an advanced level language course for the serious student who has mastered the basic elements and concepts of Latin 1 and 2, and those students wishing to continue their Latin study, but not as Advanced Placement. The Latin Prose student completes the learning of Latin forms and grammar, concentrating on use of infinitives, subjunctive verbs, gerunds, and gerundives within the classical Latin periodic sentence in Roman prose writers such as Cicero, Livy, and Pliny. Students will encounter the genres of history, commentary, and oratory. NOTE : LATIN 3 PROSE is offered in the Fall of odd years (2025, 2027,etc.)"
"Latin 4: Poetry (Love and Hate)","https://curriculum.siprep.org/courses/latin-4-poetry-love-and-hate-2/","4340","Latin","10, 11, 12","Year","Elective","E","Latin 3 or 3H","Minimum semester grade of C+ in Latin 3 or 3H or teacher recommendation","Elective which meets one year of language graduation requirement","Latin 4 Poetry is an advanced level language course for the serious student who has mastered the basic elements and concepts of Latin 1 and 2, and those students wishing to continue their Latin study but not as Advanced Placement. The Latin Poetry 3/4 student completes the learning of Latin forms and grammar, concentrating on use of infinitives, subjunctive verbs, gerunds and gerundives as used by Roman poets such as Catullus, Ovid, Vergil and Martial. Students will encounter the genres of love poetry, myth, epic and satire. NOTE : LATIN 4 POETRY is offered in the Fall of even years (2024, 2026, etc.)"
"Latin 4: Prose (Heroes and Villains)","https://curriculum.siprep.org/courses/latin-4-prose-heroes-and-villains/","4340","Latin","10, 11, 12","","Elective","E","Latin 3 or 3H","Minimum semester grade of C+ in Latin 2 or teacher recommendation","Elective which meets one year of language graduation requirement","Latin 4 Prose is an advanced level language course for the serious student who has mastered the basic elements and concepts of Latin 1 and 2, and 3 and wishes to continue the study of Latin literature, but not as Advanced Placement. The Latin Prose student reviews all Latin forms and grammar, and becomes more proficient in reading, understanding and translating the classical Latin periodic sentence in Roman prose writers such as Cicero, Livy, and Pliny. Students will encounter the genres of history, commentary, and oratory. NOTE : LATIN 4 PROSE is offered in the Fall of odd years (2025, 2027,etc.)"
"Mandarin 1","https://curriculum.siprep.org/courses/mandarin-1/","4610","Mandarin","9, 10, 11","Year","Elective","E","None","None","Meets one year of language graduation requirement","Mandarin 1 is a two-semester course designed for beginners. No background in Mandarin is presumed or required. Mandarin 1 introduces students to the four basic skills of listening, speaking, reading and writing in Mandarin Chinese. As students gain knowledge, understanding and fluency, the communication in class will be conducted in Mandarin only. By the end of the year, students are expected to pronounce the sound of Mandarin with reasonable accuracy, and to understand and sustain simple conversations in Chinese. Students will be exposed to Chinese culture in order to develop an understanding of and appreciation for different cultures and people, customs, behavior and traditions."
"Mandarin 2","https://curriculum.siprep.org/courses/mandarin-2/","4620","Mandarin","9, 10, 11","Year","Elective","E","Mandarin 1 or placement by examination","Satisfactory completion of Mandarin 1 or placement by written and oral examination","Meets one year of language graduation requirement","Mandarin 2 is a two-semester course that continues the study and development of Mandarin. This course will have combination of acquiring elementary to low intermediate level of Mandarin language use along with Chinese culture information. Students will continue developing skills in listening, speaking, reading, and writing, and expanding knowledge of grammatical structures. Instruction in written Chinese will be a combination of simplified and traditional characters. The transcription of Mandarin sounds will be in Hanyu Pinyin."
"Mandarin 2 Honors","https://curriculum.siprep.org/courses/mandarin-2h/","4623","Mandarin","9, 10, 11","Year","AP/Honors, Elective","E","Mandarin 1 or placement by examination","See criteria for Honors Enrollment or placement by examination","Meets one year of language graduation requirement","Mandarin 2H is an accelerated course designed to challenge the student who, during his/her first year, has actively participated in class, mastered the grammar and vocabulary presented in level one and/or demonstrated the ability to advance more rapidly than the average college preparatory student. The teacher will aid students in acquiring the following skills: increased oral proficiency on a variety of topics, an expanded vocabulary, the ability to read selections appropriate to low intermediate level students and increased ability to write essays. The course materials are designed to stimulate conversation and to perfect that skill, striving to imitate the native speaker’s pronunciation, accent, and rhythm, as the student’s abilities increase. Students will also become more informed about some of the contemporary problems and difficulties affecting Chinese communities. Students will further develop their ability to express themselves in spoken and written Mandarin Chinese. * Class receives honors weighting in SI weighted GPA"
"Mandarin 3","https://curriculum.siprep.org/courses/mandarin-3/","4630","Mandarin","10, 11, 12","Year","Elective","E","Mandarin 2 or placement by examination","Minimum semester grade of C in Mandarin 2 or placement by written and oral examination","Meets one year of language graduation requirement","Mandarin 3 is a third-year course that continues the study and development of Mandarin to high intermediate level. This course builds upon the skills and materials covered in Mandarin 1 and 2. It broadens the range of grammatical structures the students can effectively use in day-to-day communication, focusing on listening and reading comprehension skills, and developing students’ oral and written skills in the language. This course includes a closer look at the classic and modern Chinese culture, enriching the student’s vocabulary and deepening his or her awareness of the Mandarin-speaking world. This class is conducted mainly in Mandarin, except when complex grammar concepts require a clearer explanation in English. Students are expected to speak in Mandarin at all times."
"Mandarin 3 Honors","https://curriculum.siprep.org/courses/mandarin-3h/","4633","Mandarin","9, 10, 11, 12","Year","AP/Honors, Elective","E","Mandarin 2/2H or placement by written and oral examination","See criteria for Honors Enrollment","Meets one year of language graduation requirement","Mandarin 3H is an advanced language course designed for students identified during their first two years as superior Mandarin students, who wish to become fluent in Mandarin and prepare themselves for Mandarin 4 AP. This course broadens the range of grammatical structures the students can effectively use in communication. Considerable emphasis will be given to enriching the students’ active vocabulary and increasing their ability to comprehend and express themselves in spoken and written Mandarin. The students will be required to speak in Mandarin in various situations ranging from class discussions to oral presentations and skits. Students will be able to read with comprehension selected short stories and various articles. This course includes a closer look at the classic and modern Chinese culture, enriching the student’s vocabulary and deepening his or her awareness of the Mandarin-speaking world. This class is conducted mainly in Mandarin and students are expected to speak in Mandarin at all times. * Class receives honors weighting in SI weighted GPA and UC/CSU GPA calculations"
"Mandarin 4","https://curriculum.siprep.org/courses/mandarin-4/","4640","Mandarin","11, 12","Year","Elective","E","Mandarin 3 or placement by examination","Minimum semester grade of C in Mandarin 3 or placement by examination","Meets one year of language graduation requirement","Mandarin 4 is a two-semester course designed for students who have received an A, B or C+ in Mandarin 3 and/or teacher approval. This course is designed for students who are interested in using their foundation in Mandarin to explore in greater depth the cultures of the Chinese world through art, film, literature, history, current events, and social justice issues. The primary aim of this course is to improve the student’s ability to speak, read, write and comprehend Mandarin in more sophisticated contexts. The student will review vocabulary and grammar, master new advanced language concepts, and enhance his/her knowledge of the diversity of the Mandarin-speaking world. The class is conducted entirely in Mandarin except for complex grammatical explanations and students are expected to speak in Mandarin at all times."
"Math Analysis","https://curriculum.siprep.org/courses/math-analysis/","2460","Mathematics","12","Year","Elective","C","Algebra 1, Geometry, Algebra 2","Approval of Department Chair","","This course is designed to give each student thorough preparation in basic Trigonometry and Statistics. THIS COURSE IS NOT MEANT TO BE A PREPARATION FOR CALCULUS. Topics include the Trigonometric and Circular functions and their applications, Identities, Oblique Triangle Trig, and Vectors (in two dimensions) in rectangular and polar form. The course also includes an introduction to the major concepts and tools for collecting, analyzing, and drawing conclusions from data. A Texas Instruments TI-83 or TI-84 series graphing calculator is required."
"Mathematics Teaching Assistant","https://curriculum.siprep.org/courses/mathematics-teaching-assistant/","","Mathematics","12","Semester, Year","Elective","","None","Application Supervising Teacher Supervision, approval of Department Chair. Enrollment is via roster submitted by instructor. Students should not list this course on their Schedule Request Forms.","","Math Teaching Assistants provide support for the math department (1 hour/week) either before school, after school, or during resource period in one or more of the following ways: Assist students taking courses in which the Teaching Assistant has demonstrated mastery. Assist with grading assignments that require no teacher interpretation. Students interested in being a Teaching Assistant are required to fill out a short application available from their teacher or the math department chair. Teaching Assistants are typically supervised by an individual teacher, whose signature is required at the time of application. Students will be selected based on department needs and student qualifications. In some cases, students taking AP math courses will have priority in being a Teaching Assistant due to their qualifications in offering peer assistance."
"Mixed Chorus 1A","https://curriculum.siprep.org/courses/mixed-chorus-a/","6551","Performing Arts","10, 11, 12","Semester","Elective","F","Audition","Enrollment is via roster submitted by instructor. Students should not list this course on their Schedule Request Forms.","","This course is open to all sophomores, juniors and seniors. Students will be introduced to good practice procedures for choral rehearsal and to an awareness of different styles of choral music. Student achievement will involve study of sight-singing, notation, phrasing, rhythm, harmony and musical terminology. Students will be expected to spend additional hours beyond the regular class time. Students are expected to attend all rehearsals and performances. Ensembles will perform at concerts and choral festivals. This course is offered outside of the 9:00 am – 2:45 pm school day. Meets 1 evening per week, plus performances. One Semester; offered after school/evenings ONLY First Semester Taken: Mixed Chorus A ( 6551 ) Second Semester Taken: Mixed Chorus B ( 6552 )"
"Mixed Chorus 1B","https://curriculum.siprep.org/courses/mixed-chorus-b/","6552","Performing Arts","10, 11, 12","Semester","Elective","F","Audition","Enrollment is via roster submitted by instructor. Students should not list this course on their Schedule Request Forms.","","This course is open to all sophomores, juniors and seniors. Students will be introduced to good practice procedures for choral rehearsal and to an awareness of different styles of choral music. Student achievement will involve study of sight-singing, notation, phrasing, rhythm, harmony and musical terminology. Students will be expected to spend additional hours beyond the regular class time. Students are expected to attend all rehearsals and performances. Ensembles will perform at concerts and choral festivals. This course is offered outside of the 9:00 am – 2:45 pm school day. Meets 1 evening per week, plus performances. One Semester; offered after school/evenings ONLY First Semester Taken: Mixed Chorus A ( 6551 ) Second Semester Taken: Mixed Chorus B ( 6552 )"
"Mixed Chorus C","https://curriculum.siprep.org/courses/mixed-chorus-c/","9853","Performing Arts","10, 11, 12","Semester","Elective","F","Audition and co-enrollment in Mixed Chorus A, B, or C","Enrollment is via roster submitted by instructor. Students should not list this course on their Schedule Request Forms.","","This course is open to all sophomores, juniors and seniors who have completed Mixed Chorus A/B. Students will be introduced to good practice procedures for choral rehearsal and to an awareness of different styles of choral music. Student achievement will involve study of sight-singing, notation, phrasing, rhythm, harmony and musical terminology. Students will be expected to spend additional hours beyond the regular class time. Students are expected to attend all rehearsals and performances. Ensembles will perform at concerts and choral festivals. This course is offered outside of the 9:00 am – 2:45 pm school day. Meets 1 evening per week, plus performances. One Semester; offered after school/evenings ONLY First Semester Taken: Mixed Chorus A ( 6551 ) Second Semester Taken: Mixed Chorus B ( 6552 ) Subsequent Semesters Taken: Mixed Chorus C ( 9853 )"
"Modern World History","https://curriculum.siprep.org/courses/modern-world-history/","5201","Social Science","10","Year","Core Lower-Division","A","Introduction to Ethnic Studies","None","Required for graduation","Study of the cultural, political, geopolitical, economic, and religious factors involved in global events from the Age of Exploration and Conquest to the present day. Mastery of basic historical content, the ability to analyze and interpret both primary and secondary source materials, note-taking and research skills will be developed. Writing skills for the Social Sciences, including the development of a formal thesis, the defense of that thesis through in-class writing and a formal research paper, and identifying historical significance are a major focus. Students will also be able to trace the roots of global inequality and consider the major world events of the 20th century that continue to form our modern world."
"Modern World History – (0) Zero Period","https://curriculum.siprep.org/courses/modern-world-history-zero-period/","5202","Social Science","10","Year","","A","Introduction for Ethnic Studies","None","Required for graduation","Study of the cultural, political, geopolitical, economic, and religious factors involved in global events from the Age of Exploration and Conquest to the present day. Mastery of basic historical content, the ability to analyze and interpret both primary and secondary source materials, note-taking and research skills will be developed. Writing skills for the Social Sciences, including the development of a formal thesis, the defense of that thesis through in-class writing and a formal research paper, and identifying historical significance are a major focus. Students will also be able to trace the roots of global inequality and consider the major world events of the 20th century that continue to form our modern world. This course meets Monday-Thursday for 50 minutes (8:00 am – 8:50 am). Students who will have morning practice or another morning commitment for the whole year that would prevent them from coming to class at 8:00 am should not take this class, as regular attendance is required. This class is offered outside of the 9:00 am – 2:45 pm school day. Zero period Modern World History classes will be of average size. Courses offered during the 9:00 am – 2:45 pm school day will be double the average class size, team-taught by two teachers."
"Multimedia Design 1A","https://curriculum.siprep.org/courses/multimedia-design-1a-2/","6710","Fine Arts, Technology & Engineering","9, 10, 11, 12","Semester","Elective","F","None","Interest in developing computer multimedia and design skills through creative web, print, and animation projects","Computer Science elective satisfying one semester of Arts graduation requirement and UC Visual & Performing Arts (VPA) requirement","Step into the world of professional multimedia production and master three creative disciplines: photo editing with Adobe Photoshop, Canva, and Adobe Lightroom; video editing with Adobe Premiere Pro; and music production with Logic Pro. Within each program, students learn how to use its key tools, then move into real-world applications and collaborative processes that explore the purpose behind every creative choice. Students focus on designing original work from scratch in modern contexts. Throughout the semester, projects are designed to mirror relevant marketing tactics in creative industries, encouraging collaboration, problem-solving, and professional production standards. By gaining foundational knowledge in these three disciplines, and exploring their newest AI-powered tools, students will graduate the course with a polished, professional portfolio that demonstrates their ability to edit, design, and produce using the latest innovations in digital media!"
