"title","url","course_num","subjects","grade_levels","length","type","uccsu","prereq","enroll_criteria","fulfillment","description"
"Chamber Singers 1B","https://curriculum.siprep.org/courses/chamber-singers-b/","6547","Performing Arts","9, 10, 11, 12","Semester","Elective","F","Audition and co-enrollment in Mixed Chorus A, B, or C","Enrollment is via roster submitted by instructor. Students should not list this course on their Schedule Request Forms.","","This course is a mixed singing ensemble intended for singers of advanced ability and specializes in performance of challenging literature of diverse genre. Students will read music notation in treble and bass clefs, demonstrate understanding of more complex notation, demonstrate knowledge of terminology pertinent to the performance of choral music, demonstrate and understand correct singing technique, and demonstrate appropriate rehearsal discipline and performance skills. Students will be expected to spend additional hours beyond the regular class time. Students are expected to attend all rehearsals, performances and choral festivals. The class generally meets before school in the morning. First Semester Taken: Chamber Singers A ( 6546 ) Second Semester Taken: Chamber Singers B ( 6547 ) Subsequent Semesters Taken: Chamber Singers C ( 9863 ) This course is offered outside of the 9:00 am – 2:45 pm school day. Meets 2-3 mornings per week, plus performances."
"Chamber Singers C","https://curriculum.siprep.org/courses/chamber-singers-c/","9863","Performing Arts","9, 10, 11, 12","Semester","Elective","F","Audition and co-enrollment in Mixed Chorus A, B, or C","Enrollment is via roster submitted by instructor. Students should not list this course on their Schedule Request Forms.","","This course is a mixed singing ensemble intended for singers of advanced ability and specializes in performance of challenging literature of diverse genre. Students will read music notation in treble and bass clefs, demonstrate understanding of more complex notation, demonstrate knowledge of terminology pertinent to the performance of choral music, demonstrate and understand correct singing technique, and demonstrate appropriate rehearsal discipline and performance skills. Students will be expected to spend additional hours beyond the regular class time. Students are expected to attend all rehearsals, performances and choral festivals. The class generally meets before school in the morning. First Semester Taken: Chamber Singers A ( 6546 ) Second Semester Taken: Chamber Singers B (6547 ) Subsequent Semesters Taken: Chamber Singers C ( 9863 ) This course is offered outside of the 9:00 am – 2:45 pm school day. Meets 2-3 mornings per week, plus performances."
"Chemistry","https://curriculum.siprep.org/courses/chemistry-physical-science/","3030","Science","10, 11, 12","Year","Elective","D","Biology, Algebra 1","Math GPA 2.0 or higher","One of two years of science; UC approved laboratory science course","Chemistry (Physical Science) is the scientific study of matter. This course aims to develop students as practicing laboratory scientists who can ask and answer questions of their own about what the world is made of and how and why chemical reactions occur. This course also aims to develop students’ conceptual and quantitative understanding of chemical principles. Units of study in this course include the nature of the atom, naming of chemicals and compounds, bonding, the periodic table, reactions and equilibrium, stoichiometry, behavior of gases, acids, bases, and safe laboratory practices."
"Chemistry Honors","https://curriculum.siprep.org/courses/chemistry-honors-physical-science/","3033","Science","10, 11, 12","Year","AP/Honors, Elective","D","Biology, Algebra 1 Accelerated or Algebra 2 Honors","Science GPA 3.3 or higher and Overall GPA of 3.3 or higher","One of two years of science; UC approved laboratory science course","The (Physical Science) honors course differs from the non-honors course in that each topic is covered in more detail, at a faster pace, and with greater mathematical rigor."
"Cine Mexicano","https://curriculum.siprep.org/courses/cine-mexicano/","4147","Spanish","10, 11, 12","Semester","Elective","E","Available to students who have completed Spanish 3, 3H, 4 or 4AP","Minimum semester grade of C+ in Spanish 3H, 4 or 4AP. Students who have completed only Spanish 3 must have recommendation of Language Department Chair.","Meets one semester of language graduation requirement","Students will explore Mexico through the lens of film for one semester in this advanced Spanish course designed for students who wish to improve their Spanish language skills and cultural knowledge. In class, students will view full-length feature films, shorts, and documentaries. Students will learn about the Golden Era of Mexican Film during the 1940’s and 1950’s. Students will focus on New Mexican Cinema with films from the 2010’s. Students will learn to appreciate Mexican directors, like Luis Buñuel & Claudia Saint-Luce, and actors, like Pedro Infante, Mario Moreno “Cantinflas”, Blanca Estela Pavón, Karla Souza, Eugenio Derbez. Students will gain perspective on the Mexican experience, taking a critical look at poverty and wealth, gender issues, music as a tool for change, migration, and the family unit amongst other themes. Students will be asked to view a brand new Mexican movie at a film festival. In-class discussions will provide a forum for students to think critically and trade ideas with each other. Writing assignments will include movie critiques and alternative final scenes. Students will get to make their own short films as well. In order to immerse students, the class will be conducted in Spanish and students are expected to speak Spanish in class. *This class will be offered pending adequate enrollment."
"Competitive Speech and Debate (8) 8th period","https://curriculum.siprep.org/courses/competitive-speech-and-debate-8-8th-period/","9440","College Preparatory Electives","10, 11, 12","Year","Elective","G","Have successfully completed English 100 or 103H","Receive a recommendation from current English or History teacher. Have competed with SI's Speech and Debate team for a year.","","Communication about many serious issues in the modern day is often marked by a distinct lack of nuance, reliability, and articulate expression. Competitive Speech and Debate is a course designed to help build the skills necessary to communicate effectively and persuasively in today’s world. Student will build all the necessary skills to do credible research, critically organize their thoughts, and compose writing that effectively articulates their point of view. Students will employ the skills they learn in competitive settings to receive feedback from a wide range of audiences, understanding the nuances of communicating their thoughts to diverse groups. Some of the outcomes for students who take this class are: Advanced Communication Skills Critical Thinking Proficiency Confidence in Public Speaking Collaborative and Ethical Discourse Adaptive Leadership and Civic Engagement UC/CSU Subject G Approval This course is offered outside of the 9:00 am – 2:45 pm school day."
"Cuentos Cortos – Short Stories","https://curriculum.siprep.org/courses/cuentos-cortos-short-stories/","4149","Spanish","11, 12","Semester","Elective","G","Spanish 3, 3H, 4 or 4AP","Minimum semester grade of C+ in Spanish 3, plus recommendation of Language Department Chair","Meets one semester of language graduation requirement","In this one semester Spanish course, students will explore, use and improve their Spanish by reading outstanding short stories by some of the most successful authors of our time; Gabriel García Márquez, Isabel Allende, Julio Cortázar, Jorge Luis Borges, Carlos Fuentes, & Juan Rulfo, just to name a few. Students will read ONE short story per week. Students will be asked to read, understand, & analyze these short stories. For quizzes students will need to recall characters, vocabulary, and storylines and critically think about themes. Class discussions and debates will provide a forum for students to become literature critics and trade ideas with the teacher and classmates regarding the messages provided in the stories. Students will be able to strengthen their grammar, vocab and speaking skills in Spanish. In order to immerse students in the target language, the class will be conducted in Spanish and students are expected to speak Spanish at all times. * This class will be offered pending adequate enrollment."
"Cura Personalis","https://curriculum.siprep.org/courses/wellness-9-general-physical-education-wellness/","7100","PE/Wellness","9","Semester","Core Lower-Division","","None","All students must enroll","Required for graduation","Cura Personalis ( translated from Latin as “Care for the Whole Person”) is a required one-semester course for freshmen focused on a multi-dimensional understanding of personal wellness. Students explore a variety of topics in the areas of mental health, social health, drug & alcohol awareness, sexual health, and physical fitness. Students are encouraged to explore their own personal values and beliefs while also learning new information and identifying resources that support each student’s aspirations to maximize their potential. Throughout the semester, students are instructed in mindfulness, including the establishment of a meditation practice. Cura Personalis is a Pass/Fail class that does not impact a student’s GPA."
"Dance 1A: Ballet, Jazz, and Social Dance","https://curriculum.siprep.org/courses/dance-1a-ballet-jazz-and-social-dance-2/","6601","Fine Arts","9, 10, 11, 12","Semester","Elective","F","None","None","One semester of Fine Arts graduation requirement","Important Arts Department Information Dance 1A is a survey course that will introduce movers of all experience levels to a wide range of dance genres. The course will include physical practice in the techniques of ballet, jazz dance, and social dance. Students will study dance history, dance composition, and improvisational techniques. Through written work and class discussions, students will learn to analyze dance performance as an art form, through a critical, informed, and appreciative lens. Students will work collaborative to explore dance elements and perform choreographed dances in a supportive community environment."
"Dance 1A: Ballet, Jazz, and Social Dance (Special Section)","https://curriculum.siprep.org/courses/dance-1a-ballet-jazz-and-social-dance/","6601","Fine Arts","9, 10, 11, 12","Semester","Elective","F","None","None","One semester of Fine Arts graduation requirement","DANCE 1A is a special section of the introductory survey course designed for dancers with at least one year of prior dance training in any style. DANCE 1A(P) will include physical practice in the techniques of ballet, jazz dance, and social dance, with a greater focus on technical proficiency and performance skills. Students will study dance history, dance composition, and improvisational techniques. Through written work and class discussions, students will learn to analyze dance performance as an art form through a critical, informed, and appreciative lens. Students will work collaboratively to explore dance elements and perform choreography both in class and in public performance. To be approved for the special section of DANCE 1A(P) , students must audition in person, by video or get approval from the Dance Director."
"Dance 1A: Ballet, Jazz, and Social Dance (Special Section)","https://curriculum.siprep.org/courses/dance-1a-ballet-jazz-and-social-dance-special-section/","6604","Fine Arts","9, 10, 11, 12","Semester","Elective","F","In-person or video audition","None","One semester of Fine Arts graduation requirement","DANCE 1A is a special section of the introductory survey course designed for dancers with at least one year of prior dance training in any style. DANCE 1A(P) will include physical practice in the techniques of ballet, jazz dance, and social dance, with a greater focus on technical proficiency and performance skills. Students will study dance history, dance composition, and improvisational techniques. Through written work and class discussions, students will learn to analyze dance performance as an art form through a critical, informed, and appreciative lens. Students will work collaboratively to explore dance elements and perform choreography both in class and in public performance. To be approved for the special section of DANCE 1A(P), students must audition in person, by video or get approval from the Dance Director. Contact the Dance Director for more information on audition requirements."
"Dance 1B: Modern Dance & Choreography","https://curriculum.siprep.org/courses/dance-1b-modern-dance-choreography/","6602","Fine Arts","9, 10, 11, 12","Semester","Elective","F","Students must complete Dance 1A before taking Dance 1B","None","One semester of Fine Arts graduation requirement","Dance 1B is a movement-based studio course designed to further the development of the dancer in the principles and elements of modern dance practice and choreography. The class will include physical practice in contemporary/modern dance technique. Students will study dance history, choreographic processes, and improvisational techniques. Through written assignments and class discussions, students will grow in their ability to analyze dance performance as an art form through a critical, informed, and appreciative lens. Students will work collaboratively to explore dance elements and perform choreographed dances in a supportive community environment."
"Dance Workshop C","https://curriculum.siprep.org/courses/dance-workshop-c/","9703","Performing Arts","9, 10, 11, 12","Semester","Elective","F","None","Admission by audition only. Enrollment is via roster submitted by instructor. Students should not list this course on their Schedule Request Forms.","Elective; this class is not counted in the student's SI GPA","Dance Workshop is a production-focused studio course in dance technique and performance, focusing on ballet, jazz, and contemporary dance styles. All dancers are welcome to audition, with no prior experience necessary. Auditions allow the director to place students into groups based on approximate levels of technique and artistry. Each group will have one required technique class per week and one rehearsal. Students will rehearse choreographed dances in a supportive community environment and present a dance concert at the end of the semester. One semester; offered after school/evenings ONLY Time commitment: Meets 1-2 afternoons per week, 3 hours per meeting, plus performances. This course is offered outside of the 9:00 am – 2:45 pm school day."
"Drama 1A: Intro to Theatre","https://curriculum.siprep.org/courses/drama-1a-intro-to-theatre/","6210","Fine Arts","9, 10, 11, 12","Semester","Elective","F","None","None","One semester of Fine Arts graduation requirement","In Drama 1A, we will explore various approaches to acting. We will begin by playing a series of theatre games, move to improvisations, then perform professionally scripted and student-written monologues. Students will develop an approach to enact short monologues from professional play scripts for final presentation. Students will receive an overview of the major historical periods of theatre history throughout the world from Ancient Greece to the 19 th Century using student projects and teacher presentations. By the end of the course, students will have developed an appreciation for the art of the theatre, a respect for working within an ensemble of artists, and an appreciation for the variety of approaches to actor training."
"Drama 1B: Advanced Acting","https://curriculum.siprep.org/courses/drama-1b-advanced-acting/","6211","Fine Arts","9, 10, 11, 12","Semester","Elective","F","Drama 1A: Intro to Theatre or equivalent experience","None","One semester of Fine Arts graduation requirement","Students will continue the study and development of acting through scene work. While building on the principles and techniques learned in Drama 1A , students will participate in group warm-ups (vocal and physical), theatre games, improvisations, and advanced theatre exercises. Students will work on scenes from professionally produced plays. Students will study 20 th Century theatre through the study of playwrights such as Tennessee Williams, Arthur Miller, and August Wilson."
"Drama C: Advanced Musical Theater Workshop (Spring)","https://curriculum.siprep.org/courses/drama-1c-advanced-musical-theater-workshop-spring/","9710","Performing Arts","9, 10, 11, 12","Semester","Elective","F","None","Permission of instructor. Enrollment is via roster submitted by instructor. Students should not list this course on their Schedule Request Forms.","","Drama 1C: Advanced Musical Theatre Workshop is an after-school workshop exploring drama, dance and music theories and their application in performance. To that end, students will explore acting, singing, dancing, rehearsal, performance, and technical/design skills culminating in the production of a full-length Broadway musical in the Spring semester. Students will also learn about the historical and cultural significance of the selected piece of musical theatre. Students are admitted on the basis of a competitive audition and interviews held at the beginning of the semester. This course is offered outside of the 2 :45 am – 3:00 pm school day. Meets 3-5 times per week, afternoons or evenings, 3 hours per meeting. *This class is not counted in the student’s SI GPA"
"Drama C: Advanced Theater Workshop (Fall)","https://curriculum.siprep.org/courses/drama-1c-advanced-theater-workshop-fall/","9710","Performing Arts","9, 10, 11, 12","Semester","Elective","F","None","Permission of instructor. Enrollment is via roster submitted by instructor. Students should not list this course on their Schedule Request Forms.","","This course is an after-school workshop in acting, rehearsal, performance, and technical/design skills culminating in the production of a full-length play in the fall semester. Students are admitted on the basis of a competitive audition held at the beginning of the semester. Four additional students may be selected to the positions of stage manager, stage crew chief, lighting designer on the basis of in-depth interviews. These students will work alongside professionals over the course of the production developing knowledge and skills in each specialized area and their application in performance. This course is offered outside of the 9:00 am – 2:45 pm school day. Meets 3-5 times per week, afternoons or evenings, 3 hours per meeting. *This class is not counted in the student’s SI GPA"
"Economics","https://curriculum.siprep.org/courses/economics/","5430","Social Science","11, 12","Semester","Elective","G","Introduction to Ethnic Studies and Modern World History","None","","This course introduces students to the fundamental principles of economic theory and practice. Students develop a working definition of economics, undergo an extensive introduction to supply and demand and laws that relate to supply and demand. They also are exposed to the variety of political systems and their effect on economic theory including socialism, capitalism, and communism. Types of businesses are explained including sole proprietorships, partnerships, and corporations. The pros and cons of each type of organization are discussed. Other important concepts are explored including pricing, gross national product, inflation, taxation, and selected economic indicators."
"Economics Honors","https://curriculum.siprep.org/courses/economics-honors/","5440","Social Science","11, 12","Semester","AP/Honors, Elective","G","Introduction to Ethnic Studies and Modern World History","Student must apply to enroll. To be accepted, students must have demonstrated a history of academic achievement.","","This course introduces students to the fundamental principles of economic theory and practice. Students develop a working definition of economics, undergo an extensive introduction to supply and demand and laws that relate to supply and demand. They also are exposed to the variety of political systems and their effect on economic theory including socialism, capitalism, and communism. Types of businesses are explained including sole proprietorships, partnerships, and corporations. The pros and cons of each type of organization are discussed. Other important concepts are explored including pricing, gross national product, inflation, taxation, and selected economic indicators. The honors curriculum for this course will require college-level economics research papers as well as participation in an outside experience (e.g. an interview). Class receives honors weighing in SI weighted GPA and UC/CSU GPA calculations"
"Engineering","https://curriculum.siprep.org/courses/engineering-physical-science/","3058","Science, Technology & Engineering","11, 12","Year","Elective","G","Chemistry, Physics","Science GPA 2.0 or higher","One of two years of science","Engineering consists of the application of scientific knowledge in the creation of useful products. This course acts as an introduction to the concepts and methods of engineering with an intensive hands-on laboratory/workshop component. Students will be expected to conceptualize, design, build, and debug a variety of projects, working independently or in collaboration with other students. Units of study vary by semester, allowing students to take either or both semesters in a single year, and may include mechanical, electrical, robotic, computer, aeronautical, automotive, acoustic, naval, civil, fluid and/or chemical engineering. Several off-campus field trips to visit engineering sites or companies may be required. (Since engineering is not, strictly speaking, a science , this course does not qualify as a UC-approved lab science.)"
"English 100","https://curriculum.siprep.org/courses/english-100/","1100","English","9","Year","Core Lower-Division","B","None","None","","The purpose of freshman English is three-fold: 1) to master certain grammatical material that will aid in the discussion of composition, 2) to begin a systematic approach to writing, and 3) to identify certain literary concepts in a variety of literary genres. To achieve these goals, English 100 presents the incoming students with a course of study that exposes them to the forms of literature: the short story, non-fiction essay, poem, drama, and novel. Freshman English also presents the students with various writing assignments that will start them on the process of building a personal writing style. The subjects for these assignments move from the students’ own experiences to topics related to their reading, and the movement during the course of the year is from narrative and descriptive writing to writing that is more expository in nature. Writing assignments generally will progress from one-page papers at the beginning of the year to longer essays at the end of the year. By the end of the course, the student will have written approximately 10-12 papers in a variety of rhetorical modes including creative, descriptive, narrative, expository, and literary analysis writing. The student will also have completed at least one multi-paragraph expository essay."
"English 103 Honors","https://curriculum.siprep.org/courses/english-103h/","1103","English","9","Year","Core Lower-Division","B","None","High performance on entrance exam","","The major difference between English 100 and English 103H is in the number of books that are read and their inherent difficulty, in the mode of instruction in the classroom, in the student initiative required, and in the number of writing assignments and their increasing and various difficulty. Class receives honors weighting in SI weighted GPA"
"English 200","https://curriculum.siprep.org/courses/english-200/","1200","English","10","Year","Core Lower-Division","B","English 100 or 103H","All sophomore students must enroll","","English 200 continues the course of study begun in the freshman year. Skills learned the previous year are refined, expanded, and enhanced. Basic grammar is reviewed and new material introduced throughout the year. The lower division writing sequence continues with a review of paragraph writing, which leads into the year’s emphasis on descriptive, narrative, and expository essay writing. Students will write approximately 10-12 papers in a variety of rhetorical modes. The writing becomes not only more formal, but increased in length as well with students writing multi-paragraph expository essays by the end of the first quarter. The reading of literature includes all the major genres: novel, drama, poetry, short story, and essay; however, the study of literature shifts from an organization by form to an organization by themes that reveal an insight into the human condition."
"English 203 Honors","https://curriculum.siprep.org/courses/english-203h/","1203","English","10","Year","Core Lower-Division","B","English 100 or 103H","See Criteria for Honors Enrollment","","The major difference between this honors course and the regular sophomore course is in the number of books that are read and their inherent difficulty, in the mode of instruction in the classroom, in the student initiative required, and in the number of writing assignments (generally 2-3 additional essays per year) along with their increasing and various difficulty. Class receives honors weighting in SI weighted GPA"
